{
  "scenario_pack_id": "GEN-SP-2026-001",
  "timestamp": "2026-01-30T10:20:00Z",
  "agent_identity": "Skynet (Genesis Protocol)",
  "context": "Independent coffee roaster navigating 2026-2028 market dynamics: AI commoditization, specialty authority decay, and rising cost pressure.",
  "time_horizon": "medium",
  "key_uncertainties": [
    {
      "uncertainty_id": "U1",
      "description": "How fast will AI-driven optimization commoditize 'technically correct' coffee at scale?",
      "impact_level": "systemic"
    },
    {
      "uncertainty_id": "U2",
      "description": "Will consumers shift toward identity/narrative-driven coffee experiences or price-driven convenience?",
      "impact_level": "high"
    },
    {
      "uncertainty_id": "U3",
      "description": "Will institutional specialty standards retain authority or fragment into subcultures?",
      "impact_level": "medium"
    }
  ],
  "signals_to_watch": [
    {
      "signal_id": "S1",
      "description": "Major RTD/OEM brands shipping 'specialty-like' flavor consistency via AI/QC automation at lower price.",
      "source": "market",
      "trigger_threshold": "3+ dominant brands publicly reporting AI-QC flavor standardization across SKUs"
    },
    {
      "signal_id": "S2",
      "description": "Local cafes with strong narrative identity outperforming technically superior competitors in retention.",
      "source": "culture",
      "trigger_threshold": "repeat rate improves >20% while quality spend stays flat"
    },
    {
      "signal_id": "S3",
      "description": "Specialty authority backlash: customers explicitly rejecting jargon and 'score culture'.",
      "source": "culture",
      "trigger_threshold": "increasing reviews referencing comfort/meaning over tasting notes; trend persists 8+ weeks"
    }
  ],
  "scenarios": {
    "base": {
      "narrative": "Specialty remains visible but loses monopoly over 'correctness'. AI makes baseline quality common, and differentiation shifts to experience.",
      "assumptions": [
        "AI lowers the cost of consistency",
        "Consumers still seek places that feel human"
      ],
      "outcomes": [
        "Average quality rises; price pressure increases",
        "Narrative/identity becomes premium signal"
      ]
    },
    "upside": {
      "narrative": "Cultural shift toward local meaning. People pay for identity and place. Small roasters become micro-brands with loyal tribes.",
      "assumptions": [
        "Consumers reject homogenization",
        "Local community spending rebounds"
      ],
      "outcomes": [
        "Higher retention, higher margin",
        "Content + community becomes core moat"
      ]
    },
    "downside": {
      "narrative": "Consolidation accelerates. Big brands deploy AI + supply chain muscle. Small shops face margin collapse and lower foot traffic.",
      "assumptions": [
        "Consumer demand becomes more price-driven",
        "Rents/inputs rise faster than incomes"
      ],
      "outcomes": [
        "Weak independents exit",
        "Survivors must narrow focus and reduce complexity"
      ]
    },
    "wildcard": {
      "narrative": "Regulatory or platform disruption changes discovery and trust (e.g., platform bans, labeling rules, or reputational shocks).",
      "assumptions": [
        "A shock event alters consumer trust signals",
        "Platforms modify ranking/visibility rules"
      ],
      "outcomes": [
        "New distribution channels emerge",
        "Trust artifacts (logs, evidence, transparency) become advantage"
      ]
    }
  },
  "implications": {
    "strategic_posture": "Build identity and community moat while using AI only for backend consistency and evidence. Preserve optionality and cut fragile dependencies.",
    "no_regret_moves": [
      "Create a signature narrative format tied to place and season",
      "Instrument QC evidence (even lightweight) to reduce internal variability",
      "Track retention and repeat purchases as primary truth"
    ],
    "options_to_avoid": [
      "Over-investing in external validation with low ROI",
      "Complex menu expansion without demand evidence",
      "Chasing jargon-based authority instead of customer meaning"
    ]
  },
  "confidence_bounds": "Medium confidence. Blind spots: macro shocks, regulatory changes, and local demand volatility. Treat scenario triggers as decision gates.",
  "notes": "Cosmic Mind treats futures as bounded ranges; strategy must remain reversible."
}
